{
  "$schema": "https://json-schema.org/draft/2020-12/schema",
  "$id": "https://github.com/AI-native-Systems-Research/agentic-strategy-evolution/schemas/findings.schema.json",
  "title": "Experiment Findings",
  "description": "Prediction-vs-outcome table with discrepancy analysis for one iteration.",
  "type": "object",
  "required": ["iteration", "bundle_ref", "arms", "experiment_valid", "discrepancy_analysis"],
  "additionalProperties": false,
  "properties": {
    "iteration": { "type": "integer", "minimum": 0, "description": "Iteration number (0 = first experiment, increments on each DONE -> DESIGN transition)." },
    "bundle_ref": { "type": "string", "minLength": 1 },
    "arms": {
      "type": "array",
      "minItems": 1,
      "items": { "$ref": "#/$defs/arm_result" }
    },
    "experiment_valid": {
      "type": "boolean",
      "description": "Whether the experiment execution was sound. False if commands used wrong flags, parameters were misconfigured, or the experimental setup did not match the intended design."
    },
    "discrepancy_analysis": { "type": "string" },
    "dominant_component_pct": {
      "type": ["number", "null"],
      "minimum": 0,
      "maximum": 100,
      "description": "Percentage of total effect from single dominant component, if detected."
    },
    "gap_analysis": {
      "type": "array",
      "description": "Where the remaining score is lost, one entry per instance size group (largest loss first), measured with the local evaluator.",
      "items": {
        "type": "object",
        "required": ["group", "loss"],
        "properties": {
          "group": { "type": "string", "minLength": 1 },
          "loss": { "type": ["number", "string"], "description": "Score lost in this group, in objective units." },
          "n_instances": { "type": "integer", "minimum": 0 },
          "mean_score": { "type": "number" },
          "worst_instances": { "type": "array", "items": { "type": "string" } },
          "max_cpu_s": { "type": "number", "minimum": 0 },
          "time_limit_s": { "type": "number", "minimum": 0 },
          "timeouts": { "type": "integer", "minimum": 0 },
          "evidence": { "type": "string" }
        }
      }
    },
    "worktree_uncommitted_writes": {
      "type": "array",
      "items": { "type": "string", "minLength": 1 },
      "uniqueItems": true,
      "description": "#230 — paths the executor wrote inside the experiment worktree without declaring them in the bundle's `code_changes`. Surfaced just before worktree cleanup; logged at WARNING. #235: written unconditionally — presence of the key means the tripwire ran, value is what it found (empty list = clean run; non-empty = paths that will be lost on cleanup). Absent only when findings.json was never produced (execute-incomplete branch surfaces the data via `retry_log.jsonl` instead) or when findings.json was corrupt at write time. The orchestrator does not block cleanup on undeclared writes — this is a tripwire, not a gate."
    }
  },
  "$defs": {
    "arm_result": {
      "type": "object",
      "required": ["arm_type", "predicted", "observed", "status", "error_type", "diagnostic_note"],
      "additionalProperties": false,
      "properties": {
        "arm_type": {
          "type": "string",
          "enum": ["h-main", "h-alternative", "h-ablation", "h-super-additivity", "h-control-negative", "h-robustness", "h-dose-response", "h-tradeoff"]
        },
        "predicted": { "type": "string", "minLength": 1 },
        "observed": { "type": "string", "minLength": 1 },
        "status": {
          "type": "string",
          "enum": ["CONFIRMED", "REFUTED", "PARTIALLY_CONFIRMED"]
        },
        "error_type": {
          "type": ["string", "null"],
          "enum": ["direction", "magnitude", "regime", "shape_mismatch", null]
        },
        "diagnostic_note": { "type": ["string", "null"] },
        "metadata": {
          "type": "object",
          "description": "Optional domain-specific metadata for this arm result."
        },
        "observed_shape": {
          "type": ["string", "null"],
          "enum": ["monotone_decreasing", "monotone_increasing", "u_shaped", "inverted_u", "saturating", "flat", "noisy", null],
          "description": "Classified shape for h-dose-response arms."
        },
        "shape_match": {
          "type": ["boolean", "null"],
          "description": "True if observed_shape matches the arm's expected_shape."
        },
        "dose_points": {
          "type": ["array", "null"],
          "items": {
            "type": "object",
            "required": ["value", "metric"],
            "additionalProperties": false,
            "properties": {
              "value": {
                "oneOf": [{ "type": "number" }, { "type": "string", "minLength": 1 }]
              },
              "metric": { "type": ["number", "null"] }
            }
          },
          "description": "Observed (knob_value, metric_value) pairs for h-dose-response arms."
        },
        "primary_change_observed": {
          "type": ["number", "null"],
          "description": "Observed change in primary metric for h-tradeoff arms."
        },
        "secondary_change_observed": {
          "type": ["number", "null"],
          "description": "Observed change in secondary metric for h-tradeoff arms."
        },
        "primary_predicate_met": {
          "type": ["boolean", "null"]
        },
        "secondary_predicate_met": {
          "type": ["boolean", "null"]
        },
        "tradeoff_verdict": {
          "type": ["string", "null"],
          "enum": ["confirmed", "primary_failed", "cost_too_high", "both_failed", null],
          "description": "Verdict for h-tradeoff arms; cost_too_high is the new failure mode this arm unlocks."
        }
      }
    }
  }
}
